{"runId":"run_7423d344190c425b","conversationId":"conv_001","state":"COMPLETED","currentUi":{"schemaVersion":"1.0","screenId":"refund-result","title":"退款已提交","components":[{"id":"result","type":"Result","props":{"status":"success","title":"退款已提交","description":"退款 128.00 元将在 1-3 个工作日内原路退回。","details":[{"label":"订单号","value":"10001"},{"label":"退款单号","value":"rf_21e43214462a"},{"label":"退款金额","value":"128.00"}]}}],"actions":[]},"createdAt":"2026-09-12T15:59:49.597128Z","updatedAt":"2026-09-12T15:59:49.703640Z"}