{"runId":"run_f8ed6e1f40904fd4","conversationId":"conv_r1","state":"COMPLETED","currentUi":{"schemaVersion":"1.0","screenId":"clarify-order","title":"请选择订单","components":[{"id":"clarify","type":"Table","props":{"columns":[{"key":"orderId","title":"orderId"},{"key":"productId","title":"productId"},{"key":"productName","title":"productName"},{"key":"thumbnail","title":"thumbnail"},{"key":"quantity","title":"quantity"},{"key":"amount","title":"amount"}],"rows":[{"id":"10030","cells":{"orderId":"10030","productId":"P-1003","productName":"无线耳机 Pro","thumbnail":"headphones","quantity":"1","amount":"899.00"},"actions":[{"label":"选择","intent":"选择 订单 10030"}]},{"id":"10029","cells":{"orderId":"10029","productId":"P-1002","productName":"轻薄笔记本 14 等 2 件","thumbnail":"laptop","quantity":"4","amount":"14134.00"},"actions":[{"label":"选择","intent":"选择 订单 10029"}]},{"id":"10028","cells":{"orderId":"10028","productId":"P-1017","productName":"精品咖啡豆 500g 等 2 件","thumbnail":"coffee","quantity":"4","amount":"594.00"},"actions":[{"label":"选择","intent":"选择 订单 10028"}]},{"id":"10027","cells":{"orderId":"10027","productId":"P-1020","productName":"巧克力礼盒 等 3 件","thumbnail":"gift","quantity":"3","amount":"7107.90"},"actions":[{"label":"选择","intent":"选择 订单 10027"}]},{"id":"10026","cells":{"orderId":"10026","productId":"P-1009","productName":"收纳箱三件套 等 3 件","thumbnail":"box","quantity":"6","amount":"375.80"},"actions":[{"label":"选择","intent":"选择 订单 10026"}]},{"id":"10025","cells":{"orderId":"10025","productId":"P-1020","productName":"巧克力礼盒","thumbnail":"gift","quantity":"2","amount":"198.00"},"actions":[{"label":"选择","intent":"选择 订单 10025"}]},{"id":"10024","cells":{"orderId":"10024","productId":"P-1006","productName":"北欧风落地灯","thumbnail":"lamp","quantity":"2","amount":"918.00"},"actions":[{"label":"选择","intent":"选择 订单 10024"}]},{"id":"10023","cells":{"orderId":"10023","productId":"P-1008","productName":"香薰机","thumbnail":"home","quantity":"1","amount":"169.00"},"actions":[{"label":"选择","intent":"选择 订单 10023"}]},{"id":"10022","cells":{"orderId":"10022","productId":"P-1008","productName":"香薰机","thumbnail":"home","quantity":"1","amount":"169.00"},"actions":[{"label":"选择","intent":"选择 订单 10022"}]},{"id":"10021","cells":{"orderId":"10021","productId":"P-1011","productName":"智能台灯 等 3 件","thumbnail":"lamp","quantity":"6","amount":"3994.00"},"actions":[{"label":"选择","intent":"选择 订单 10021"}]},{"id":"10020","cells":{"orderId":"10020","productId":"P-1016","productName":"手工曲奇礼盒 等 3 件","thumbnail":"cookie","quantity":"6","amount":"652.00"},"actions":[{"label":"选择","intent":"选择 订单 10020"}]},{"id":"10019","cells":{"orderId":"10019","productId":"P-1003","productName":"无线耳机 Pro 等 2 件","thumbnail":"headphones","quantity":"2","amount":"7898.00"},"actions":[{"label":"选择","intent":"选择 订单 10019"}]},{"id":"10018","cells":{"orderId":"10018","productId":"P-1016","productName":"手工曲奇礼盒 等 3 件","thumbnail":"cookie","quantity":"5","amount":"662.00"},"actions":[{"label":"选择","intent":"选择 订单 10018"}]},{"id":"10017","cells":{"orderId":"10017","productId":"P-1007","productName":"记忆棉枕头 等 2 件","thumbnail":"home","quantity":"3","amount":"5257.00"},"actions":[{"label":"选择","intent":"选择 订单 10017"}]},{"id":"10016","cells":{"orderId":"10016","productId":"P-1019","productName":"有机茶叶 等 3 件","thumbnail":"coffee","quantity":"5","amount":"916.80"},"actions":[{"label":"选择","intent":"选择 订单 10016"}]},{"id":"10015","cells":{"orderId":"10015","productId":"P-1004","productName":"智能手表 S","thumbnail":"watch","quantity":"2","amount":"2598.00"},"actions":[{"label":"选择","intent":"选择 订单 10015"}]},{"id":"10014","cells":{"orderId":"10014","productId":"P-1015","productName":"牛仔裤 等 3 件","thumbnail":"shirt","quantity":"6","amount":"14734.00"},"actions":[{"label":"选择","intent":"选择 订单 10014"}]},{"id":"10013","cells":{"orderId":"10013","productId":"P-1003","productName":"无线耳机 Pro","thumbnail":"headphones","quantity":"1","amount":"899.00"},"actions":[{"label":"选择","intent":"选择 订单 10013"}]},{"id":"10012","cells":{"orderId":"10012","productId":"P-1005","productName":"蓝牙耳机 等 2 件","thumbnail":"headphones","quantity":"4","amount":"1516.00"},"actions":[{"label":"选择","intent":"选择 订单 10012"}]},{"id":"10011","cells":{"orderId":"10011","productId":"P-1006","productName":"北欧风落地灯","thumbnail":"lamp","quantity":"1","amount":"459.00"},"actions":[{"label":"选择","intent":"选择 订单 10011"}]}],"total":20}}],"actions":[]},"createdAt":"2026-09-12T12:19:40.141290Z","updatedAt":"2026-09-12T12:19:40.145655Z"}