{"runId":"run_15fd535877f34c1a","conversationId":"conv_001","state":"WAITING_CONFIRMATION","currentUi":{"schemaVersion":"1.0","screenId":"refund-confirmation","title":"确认退款","components":[{"id":"order","type":"OrderCard","props":{"orderId":"10001","productName":"订单 10001","amount":"128.00","currency":"CNY","status":"PAID"}},{"id":"refund-summary","type":"RefundConfirmCard","props":{"orderId":"10001","amount":"128.00","currency":"CNY","eligible":true,"estimatedDays":3}},{"id":"refund-form","type":"Form","props":{"fields":[{"name":"reason","type":"select","label":"退款原因","required":true,"options":[{"label":"商品破损","value":"DAMAGED"},{"label":"未收到货","value":"NOT_RECEIVED"},{"label":"买错了","value":"CHANGED_MIND"}]}]}}],"actions":[{"id":"confirm-refund","type":"submit","label":"确认退款","style":"danger","confirmationToken":"ct_s97lPinrfQe6bJIW0l5fXXctcmByvFyO"},{"id":"cancel","type":"cancel","label":"取消","style":"default"}]},"createdAt":"2026-09-08T06:51:14.275563Z","updatedAt":"2026-09-08T06:51:30.979667Z"}